{
  "version": 4,
  "description": "CI regression fixtures for progressive-context routing; the compiled context graph is the runtime source, and this file is not a second router or trigger source. 5fedu activation is a fail-closed workspace fact: only .agent/profiles/5fedu.enabled or a validated installed README/rules/behavior/module-mapping lean pack is active. Prompt text, empty/junk context directories, and legacy 00-context-map.md alone are not activation evidence.",
  "budgets": {
    "core_routing_tokens": 4500,
    "normal_execution_tokens": 1550,
    "uncertain_execution_tokens": 2700,
    "plan_authoring_tokens": 4200,
    "harness_edit_tokens": 2800,
    "5fedu_ui_base_tokens": 8000
  },
  "routes": {
    "normal_execution": [
      "skills/finish-to-completion/SKILL.md"
    ],
    "uncertain_execution": [
      "skills/finish-to-completion/SKILL.md"
    ],
    "plan_authoring": [
      "skills/plan-and-handoff/SKILL.md",
      "skills/plan-and-handoff/references/plan-artifact-template.md"
    ],
    "harness_edit": [
      "skills/context-evolution-protocol/SKILL.md"
    ],
    "5fedu_ui_base": [
      "profiles/5fedu/README.md",
      "profiles/5fedu/skills/5fedu-project/SKILL.md",
      "profiles/5fedu/skills/5fedu-module-parity/SKILL.md",
      "profiles/5fedu/skills/5fedu-module-parity/references/index.md",
      "profiles/5fedu/module-mapping/modules.yaml",
      "profiles/5fedu/module-mapping/ui-contracts.md"
    ]
  },
  "cases": [
    {
      "id": "qa-simple",
      "prompt": "Giải thích cách xử lý đơn giản",
      "workspace": {
        "kind": "generic",
        "has_5fedu_context": false
      },
      "expect": {
        "primary": null,
        "required_skills": [],
        "forbidden_skills": [
          "plan-and-handoff",
          "finish-to-completion",
          "browser-qa",
          "context-evolution-protocol"
        ]
      }
    },
    {
      "id": "generic-module",
      "prompt": "Refactor module thanh toán Node.js",
      "workspace": {
        "kind": "generic",
        "has_5fedu_context": false
      },
      "expect": {
        "primary": "finish-to-completion",
        "required_skills": [],
        "forbidden_skills": [
          "5fedu-project",
          "5fedu-module-parity"
        ]
      }
    },
    {
      "id": "5fedu-ui",
      "prompt": "Sửa module 5fedu lệch pattern drawer",
      "workspace": {
        "kind": "5fedu-app",
        "has_5fedu_context": true,
        "lean_pack": "valid"
      },
      "expect": {
        "primary": "5fedu-module-parity",
        "required_skills": [
          "5fedu-project"
        ],
        "forbidden_skills": [
          "frontend-architect"
        ],
        "intent_signals": [
          "5fedu_ui"
        ],
        "exact_context_nodes": [
          "profile:5fedu:module-mapping",
          "profile:5fedu:readme",
          "profile:5fedu:ui-contracts",
          "reference:5fedu-module-parity:profiles:5fedu:skills:5fedu:module:parity:references:index:md"
        ]
      }
    },
    {
      "id": "5fedu-ui-domain-precedes-browser",
      "prompt": "Sửa module 5fedu lệch pattern drawer và click-through browser",
      "workspace": {
        "kind": "5fedu-app",
        "has_5fedu_context": true,
        "lean_pack": "valid"
      },
      "expect": {
        "primary": "5fedu-module-parity",
        "required_skills": [
          "5fedu-project"
        ],
        "forbidden_skills": [
          "frontend-architect"
        ],
        "intent_signals": [
          "5fedu_ui"
        ]
      }
    },
    {
      "id": "5fedu-ui-explicit-profile-marker",
      "prompt": "Sửa module 5fedu lệch pattern drawer",
      "workspace": {
        "kind": "generic",
        "has_5fedu_context": false,
        "profile_marker": true,
        "lean_pack": "missing"
      },
      "expect": {
        "primary": "5fedu-module-parity",
        "required_skills": [
          "5fedu-project"
        ],
        "forbidden_skills": [
          "frontend-architect"
        ],
        "intent_signals": [
          "5fedu_ui"
        ],
        "workspace_facts": {
          "has_enabled_5fedu_profile": true,
          "has_valid_5fedu_lean_pack": false,
          "is_5fedu_profile_active": true
        },
        "exact_context_nodes": [
          "profile:5fedu:module-mapping",
          "profile:5fedu:readme",
          "profile:5fedu:ui-contracts",
          "reference:5fedu-module-parity:profiles:5fedu:skills:5fedu:module:parity:references:index:md"
        ]
      }
    },
    {
      "id": "5fedu-ui-valid-installed-lean-pack",
      "prompt": "Sửa module 5fedu lệch pattern drawer",
      "workspace": {
        "kind": "5fedu-app",
        "has_5fedu_context": true,
        "lean_pack": "valid"
      },
      "expect": {
        "primary": "5fedu-module-parity",
        "required_skills": [
          "5fedu-project"
        ],
        "forbidden_skills": [
          "frontend-architect"
        ],
        "intent_signals": [
          "5fedu_ui"
        ],
        "workspace_facts": {
          "has_enabled_5fedu_profile": false,
          "has_valid_5fedu_lean_pack": true,
          "is_5fedu_profile_active": true
        },
        "exact_context_nodes": [
          "profile:5fedu:module-mapping",
          "profile:5fedu:readme",
          "profile:5fedu:ui-contracts",
          "reference:5fedu-module-parity:profiles:5fedu:skills:5fedu:module:parity:references:index:md"
        ]
      }
    },
    {
      "id": "5fedu-ui-empty-context-is-inactive",
      "prompt": "Sửa module 5fedu lệch pattern drawer",
      "workspace": {
        "kind": "generic",
        "has_5fedu_context": false,
        "lean_pack": "empty"
      },
      "expect": {
        "primary": null,
        "required_skills": [],
        "forbidden_skills": [
          "5fedu-project",
          "5fedu-module-parity"
        ],
        "workspace_facts": {
          "has_enabled_5fedu_profile": false,
          "has_valid_5fedu_lean_pack": false,
          "is_5fedu_profile_active": false
        }
      }
    },
    {
      "id": "5fedu-ui-junk-context-is-inactive",
      "prompt": "Sửa module 5fedu lệch pattern drawer",
      "workspace": {
        "kind": "generic",
        "has_5fedu_context": false,
        "lean_pack": "junk-readme-or-legacy-map"
      },
      "expect": {
        "primary": null,
        "required_skills": [],
        "forbidden_skills": [
          "5fedu-project",
          "5fedu-module-parity"
        ],
        "workspace_facts": {
          "has_enabled_5fedu_profile": false,
          "has_valid_5fedu_lean_pack": false,
          "is_5fedu_profile_active": false
        }
      }
    },
    {
      "id": "5fedu-ui-partial-context-is-inactive",
      "prompt": "Sửa module 5fedu lệch pattern drawer",
      "workspace": {
        "kind": "generic",
        "has_5fedu_context": false,
        "lean_pack": "partial"
      },
      "expect": {
        "primary": null,
        "required_skills": [],
        "forbidden_skills": [
          "5fedu-project",
          "5fedu-module-parity"
        ],
        "workspace_facts": {
          "has_enabled_5fedu_profile": false,
          "has_valid_5fedu_lean_pack": false,
          "is_5fedu_profile_active": false
        }
      }
    },
    {
      "id": "5fedu-ui-hash-tampered-pack-is-inactive",
      "prompt": "Sửa module 5fedu lệch pattern drawer",
      "workspace": {
        "kind": "generic",
        "has_5fedu_context": false,
        "lean_pack": "hash-tampered"
      },
      "expect": {
        "primary": null,
        "required_skills": [],
        "forbidden_skills": [
          "5fedu-project",
          "5fedu-module-parity"
        ],
        "workspace_facts": {
          "has_enabled_5fedu_profile": false,
          "has_valid_5fedu_lean_pack": false,
          "is_5fedu_profile_active": false
        }
      }
    },
    {
      "id": "5fedu-ui-ancestor-symlink-is-inactive",
      "prompt": "Sửa module 5fedu lệch pattern drawer",
      "workspace": {
        "kind": "generic",
        "has_5fedu_context": false,
        "lean_pack": "ancestor-symlink"
      },
      "expect": {
        "primary": null,
        "required_skills": [],
        "forbidden_skills": [
          "5fedu-project",
          "5fedu-module-parity"
        ],
        "workspace_facts": {
          "has_enabled_5fedu_profile": false,
          "has_valid_5fedu_lean_pack": false,
          "is_5fedu_profile_active": false
        }
      }
    },
    {
      "id": "5fedu-ordinary-ui-has-no-activation-node",
      "prompt": "Sửa module 5fedu lệch pattern drawer",
      "workspace": {
        "kind": "5fedu-app",
        "has_5fedu_context": true,
        "lean_pack": "valid"
      },
      "expect": {
        "primary": "5fedu-module-parity",
        "required_skills": [
          "5fedu-project"
        ],
        "forbidden_skills": [
          "frontend-architect"
        ],
        "exact_context_nodes": [
          "profile:5fedu:module-mapping",
          "profile:5fedu:readme",
          "profile:5fedu:ui-contracts",
          "reference:5fedu-module-parity:profiles:5fedu:skills:5fedu:module:parity:references:index:md"
        ]
      }
    },
    {
      "id": "5fedu-setup-loads-activation-only-when-active",
      "prompt": "Thiết lập 5fedu cho dự án",
      "workspace": {
        "kind": "5fedu-app",
        "has_5fedu_context": true,
        "lean_pack": "valid"
      },
      "expect": {
        "primary": "5fedu-module-parity",
        "required_skills": [
          "5fedu-project"
        ],
        "forbidden_skills": [
          "frontend-architect"
        ],
        "intent_signals": [
          "5fedu_setup"
        ],
        "exact_context_nodes": [
          "profile:5fedu:behavior:activation",
          "profile:5fedu:module-mapping",
          "profile:5fedu:readme",
          "profile:5fedu:ui-contracts",